{
  "$schema": "../../../schemas/policy.schema.json",
  "comment": [
    "TRANSITION ONLY: retain this legacy ADMX_AdmPwd policy until the complete modern LAPS CSP",
    "policy in laps-account-management.json has applied and Entra password backup is verified.",
    "These legacy settings do not configure modern Windows LAPS and are not inherited by it.",
    "Deleting this definition now would schedule an orphan deletion; normal deployment correctly",
    "refuses unapproved deletes. After backup and emergency access are verified, remove this file",
    "and retire the exact live legacy policy with an explicitly reviewed deletion.",
    "Do not add new settings here. The modern policy owns all future LAPS changes."
  ],
  "name": "laps",
  "resource": "deviceManagementConfigurationPolicies",
  "assignments": [
    { "group": "sg-devices-adult", "intent": "include" },
    { "group": "sg-devices-teen", "intent": "include" },
    { "group": "sg-devices-child", "intent": "include" }
  ],
  "payload": {
    "@odata.type": "#microsoft.graph.deviceManagementConfigurationPolicy",
    "displayName": "CaC - Windows LAPS",
    "description": "Managed by sf-intune-cac. Do not edit in the portal.",
    "platforms": "windows10",
    "technologies": "mdm",
    "settings": [
      {
        "settingInstance": {
          "@odata.type": "#microsoft.graph.deviceManagementConfigurationChoiceSettingInstance",
          "settingDefinitionId": "device_vendor_msft_policy_config_admx_admpwd_pol_admpwd_enabled",
          "choiceSettingValue": {
            "value": "device_vendor_msft_policy_config_admx_admpwd_pol_admpwd_enabled_1",
            "children": []
          }
        }
      },
      {
        "settingInstance": {
          "@odata.type": "#microsoft.graph.deviceManagementConfigurationChoiceSettingInstance",
          "settingDefinitionId": "device_vendor_msft_policy_config_admx_admpwd_pol_admpwd_adminname",
          "choiceSettingValue": {
            "value": "device_vendor_msft_policy_config_admx_admpwd_pol_admpwd_adminname_1",
            "children": [
              {
                "@odata.type": "#microsoft.graph.deviceManagementConfigurationSimpleSettingInstance",
                "settingDefinitionId": "device_vendor_msft_policy_config_admx_admpwd_pol_admpwd_adminname_txt_adminaccountname",
                "simpleSettingValue": {
                  "@odata.type": "#microsoft.graph.deviceManagementConfigurationStringSettingValue",
                  "value": "x3nc0n"
                }
              }
            ]
          }
        }
      },
      {
        "settingInstance": {
          "@odata.type": "#microsoft.graph.deviceManagementConfigurationChoiceSettingInstance",
          "settingDefinitionId": "device_vendor_msft_policy_config_admx_admpwd_pol_admpwd",
          "choiceSettingValue": {
            "value": "device_vendor_msft_policy_config_admx_admpwd_pol_admpwd_1",
            "children": [
              {
                "@odata.type": "#microsoft.graph.deviceManagementConfigurationSimpleSettingInstance",
                "settingDefinitionId": "device_vendor_msft_policy_config_admx_admpwd_pol_admpwd_elm_admpwd_passwordagedays",
                "simpleSettingValue": {
                  "@odata.type": "#microsoft.graph.deviceManagementConfigurationIntegerSettingValue",
                  "value": 30
                }
              },
              {
                "@odata.type": "#microsoft.graph.deviceManagementConfigurationChoiceSettingInstance",
                "settingDefinitionId": "device_vendor_msft_policy_config_admx_admpwd_pol_admpwd_elm_admpwd_passwordcomplexity",
                "choiceSettingValue": {
                  "value": "device_vendor_msft_policy_config_admx_admpwd_pol_admpwd_elm_admpwd_passwordcomplexity_4",
                  "children": []
                }
              },
              {
                "@odata.type": "#microsoft.graph.deviceManagementConfigurationSimpleSettingInstance",
                "settingDefinitionId": "device_vendor_msft_policy_config_admx_admpwd_pol_admpwd_elm_admpwd_passwordlength",
                "simpleSettingValue": {
                  "@odata.type": "#microsoft.graph.deviceManagementConfigurationIntegerSettingValue",
                  "value": 14
                }
              }
            ]
          }
        }
      }
    ]
  }
}
