{
  "$schema": "../../../schemas/policy.schema.json",
  "comment": [
    "Adopts the pre-existing, manually-created live Settings Catalog policy 'SF Adults Local",
    "Admin' (id 6179ed47-e39e-4bd9-825b-80adb13df242 at adoption time; not stored here since",
    "matching is by displayName/name, never by id - see config/tenant.json's adoption.policies",
    "entry with id 'local-admin-adult-all-device-tiers'). payload.displayName below MUST exactly",
    "equal the live object's real name ('SF Adults Local Admin') for one-time adoption to match;",
    "do not rename it without updating tenant.json's adoption spec in lockstep.",
    "Assignment (all 3 device-tier groups) already matches desired state - adoption is expected",
    "to settle at NoChange for assignment on first run.",
    "Additive-membership CSP shape verified against the live object by Trinity's prior read-only",
    "inventory (see .squad/decisions/inbox/trinity-resolve-local-admin-targets.md and",
    "scripts/bootstrap/Resolve-CaCLocalAdminPolicyTargets.ps1); member SID",
    "S-1-12-1-1322638706-1150646150-2137834924-157029862 is the confirmed AAD-encoded SID for",
    "CaC-Tier-Adult (group id 4ed5dd72-7786-4495-acc5-6c7fe6155c09)."
  ],
  "name": "local-admin-adult-all-device-tiers",
  "resource": "deviceManagementConfigurationPolicies",
  "assignments": [
    { "group": "sg-devices-adult", "intent": "include" },
    { "group": "sg-devices-teen", "intent": "include" },
    { "group": "sg-devices-child", "intent": "include" }
  ],
  "payload": {
    "@odata.type": "#microsoft.graph.deviceManagementConfigurationPolicy",
    "displayName": "SF Adults Local Admin",
    "description": "Managed by sf-intune-cac. Do not edit in the portal.",
    "platforms": "windows10",
    "technologies": "mdm",
    "settings": [
      {
        "settingInstance": {
          "@odata.type": "#microsoft.graph.deviceManagementConfigurationGroupSettingCollectionInstance",
          "settingDefinitionId": "device_vendor_msft_policy_config_localusersandgroups_configure",
          "groupSettingCollectionValue": [
            {
              "children": [
                {
                  "@odata.type": "#microsoft.graph.deviceManagementConfigurationGroupSettingCollectionInstance",
                  "settingDefinitionId": "device_vendor_msft_policy_config_localusersandgroups_configure_groupconfiguration_accessgroup",
                  "groupSettingCollectionValue": [
                    {
                      "children": [
                        {
                          "@odata.type": "#microsoft.graph.deviceManagementConfigurationChoiceSettingCollectionInstance",
                          "settingDefinitionId": "device_vendor_msft_policy_config_localusersandgroups_configure_groupconfiguration_accessgroup_desc",
                          "choiceSettingCollectionValue": [
                            {
                              "value": "device_vendor_msft_policy_config_localusersandgroups_configure_groupconfiguration_accessgroup_desc_administrators",
                              "children": []
                            }
                          ]
                        },
                        {
                          "@odata.type": "#microsoft.graph.deviceManagementConfigurationChoiceSettingInstance",
                          "settingDefinitionId": "device_vendor_msft_policy_config_localusersandgroups_configure_groupconfiguration_accessgroup_action",
                          "choiceSettingValue": {
                            "value": "device_vendor_msft_policy_config_localusersandgroups_configure_groupconfiguration_accessgroup_action_add_update",
                            "children": []
                          }
                        },
                        {
                          "@odata.type": "#microsoft.graph.deviceManagementConfigurationChoiceSettingInstance",
                          "settingDefinitionId": "device_vendor_msft_policy_config_localusersandgroups_configure_groupconfiguration_accessgroup_userselectiontype",
                          "choiceSettingValue": {
                            "value": "device_vendor_msft_policy_config_localusersandgroups_configure_groupconfiguration_accessgroup_userselectiontype_users",
                            "children": [
                              {
                                "@odata.type": "#microsoft.graph.deviceManagementConfigurationSimpleSettingCollectionInstance",
                                "settingDefinitionId": "device_vendor_msft_policy_config_localusersandgroups_configure_groupconfiguration_accessgroup_users",
                                "simpleSettingCollectionValue": [
                                  {
                                    "@odata.type": "#microsoft.graph.deviceManagementConfigurationStringSettingValue",
                                    "value": "S-1-12-1-1322638706-1150646150-2137834924-157029862"
                                  }
                                ]
                              }
                            ]
                          }
                        }
                      ]
                    }
                  ]
                }
              ]
            }
          ]
        }
      }
    ]
  }
}
