{
  "$schema": "../../../schemas/policy.schema.json",
  "comment": [
    "Corporate-owned fully managed Android baseline. Public app installation and account changes are",
    "blocked; approved Managed Google Play apps remain deployable by Intune.",
    "2026-08-17: removed 'fingerprint' from passwordBlockKeyguardFeatures - it was blocking fingerprint",
    "unlock at the keyguard entirely (this is what 'disabled itself' on the Moto G Stylus; it wasn't a",
    "device bug, it was this policy). PIN/password was never blocked by this policy - passwordRequiredType",
    "already requires numericComplex regardless of biometric state. 'face' stays blocked (not requested).",
    "Also added playStoreMode: allowList so the Play Store itself only shows the curated app catalog,",
    "further reducing exposure to Google's own apps/search beyond what googleAccountsBlocked already covers.",
    "2026-08-17: flipped accountsBlockModification to false. It was blocking ALL account add/remove, which",
    "would have also blocked adding a personal Microsoft Account for Microsoft Family Safety's lighter",
    "parental controls. googleAccountsBlocked (still true, below) is the correctly-scoped restriction for",
    "keeping Google accounts out specifically; it does not depend on accountsBlockModification being true.",
    "2026-08-18: moved assignment from sg-tier-child to sg-devices-child because this is a corporate-owned",
    "device restriction baseline and should target the dedicated child device group, not the user identity",
    "tier group. Also set bluetoothBlockConfiguration to false per owner request and explicitly set",
    "shareDeviceLocationDisabled to false so Intune admin Locate device capability remains allowed and the",
    "config-as-code intent is documented rather than relying on the default.",
    "2026-09-08: added vpnAlwaysOnPackageIdentifier/vpnAlwaysOnLockdownMode targeting Defender's GSA client",
    "(com.microsoft.scmx). The app-config values in android-defender-gsa-child.json (Global Secure Access =",
    "integer 3; GlobalSecureAccessPrivateChannel = integer 0, Private Access unused) only stop the user from disabling GSA",
    "inside Defender - they don't force every app's traffic through the tunnel. Lockdown mode denies all",
    "network connectivity if the VPN isn't connected, closing the gap where other apps could bypass the tunnel."
  ],
  "name": "android-fully-managed-restrictions-child",
  "resource": "deviceConfigurations",
  "assignments": [{ "group": "sg-devices-child", "intent": "include" }],
  "payload": {
    "@odata.type": "#microsoft.graph.androidDeviceOwnerGeneralDeviceConfiguration",
    "displayName": "CaC - Android - Fully Managed Restrictions (Child)",
    "description": "Managed by sf-intune-cac. Do not edit in the portal.",
    "enrollmentProfile": "fullyManaged",
    "accountsBlockModification": false,
    "appsAllowInstallFromUnknownSources": false,
    "appsAutoUpdatePolicy": "always",
    "appsDefaultPermissionPolicy": "prompt",
    "bluetoothBlockConfiguration": false,
    "cameraBlocked": false,
    "dateTimeConfigurationBlocked": true,
    "factoryResetBlocked": true,
    "googleAccountsBlocked": true,
    "networkEscapeHatchAllowed": false,
    "nfcBlockOutgoingBeam": true,
    "passwordBlockKeyguardFeatures": ["trustAgents", "face"],
    "passwordMinimumLength": 6,
    "passwordRequiredType": "numericComplex",
    "passwordMinutesOfInactivityBeforeScreenTimeout": 5,
    "playStoreMode": "allowList",
    "screenCaptureBlocked": true,
    "securityDeveloperSettingsEnabled": false,
    "securityRequireVerifyApps": true,
    "shareDeviceLocationDisabled": false,
    "storageBlockExternalMedia": true,
    "storageBlockUsbFileTransfer": true,
    "systemUpdateInstallType": "automatic",
    "usersBlockAdd": true,
    "usersBlockRemove": true,
    "vpnAlwaysOnPackageIdentifier": "com.microsoft.scmx",
    "vpnAlwaysOnLockdownMode": true
  }
}
