{
  "$schema": "../../../schemas/policy.schema.json",
  "comment": [
    "14-17. Deliberately lighter than the child tier: the Store is allowed, developer tools stay",
    "usable, and Defender's UI is not hidden. Privileges increase with age; only the security",
    "relevant settings are kept.",
    "2026-10-01: SmartScreen app install control is off and trusted-app sideloading is not",
    "configured, so teens can install apps from anywhere rather than the Microsoft Store only.",
    "SmartScreen still warns on unrecognised downloads (Edge requires it). The values are set",
    "explicitly rather than removed so the plan detects and reverts the old live values."
  ],
  "name": "windows-restrictions-teen",
  "resource": "deviceConfigurations",
  "assignments": [{ "group": "sg-tier-teen", "intent": "include" }],
  "payload": {
    "@odata.type": "#microsoft.graph.windows10GeneralConfiguration",
    "displayName": "CaC - Windows - Device Restrictions (Teen)",
    "description": "Managed by sf-intune-cac. Do not edit in the portal.",
    "windowsStoreBlocked": false,
    "appsAllowTrustedAppsSideloading": "notConfigured",
    "developerUnlockSetting": "blocked",
    "smartScreenEnableAppInstallControl": false,
    "defenderRequireRealTimeMonitoring": true,
    "defenderRequireBehaviorMonitoring": true,
    "defenderScanDownloads": true,
    "edgeRequireSmartScreen": true,
    "edgeBlockInPrivateBrowsing": true,
    "edgeBlockPopups": true,
    "storageRequireMobileDeviceEncryption": true
  }
}
