{
  "$schema": "../../../schemas/policy.schema.json",
  "comment": "Security-only compliance floor for macOS. Applies to every tier.",
  "name": "macos-compliance-baseline",
  "resource": "deviceCompliancePolicies",
  "assignments": [{ "group": "sg-productivity-all", "intent": "include" }],
  "payload": {
    "@odata.type": "#microsoft.graph.macOSCompliancePolicy",
    "displayName": "CaC - macOS - Compliance Baseline",
    "description": "Managed by sf-intune-cac. Do not edit in the portal.",
    "passwordRequired": true,
    "passwordBlockSimple": true,
    "passwordMinimumLength": 8,
    "passwordRequiredType": "alphanumeric",
    "passwordMinutesOfInactivityBeforeLock": 15,
    "systemIntegrityProtectionEnabled": true,
    "deviceThreatProtectionEnabled": false,
    "storageRequireEncryption": true,
    "firewallEnabled": true,
    "firewallBlockAllIncoming": false,
    "firewallEnableStealthMode": true,
    "osMinimumVersion": "14.0",
    "scheduledActionsForRule": [
      {
        "ruleName": "PasswordRequired",
        "scheduledActionConfigurations": [
          {
            "actionType": "notification",
            "gracePeriodHours": 0,
            "notificationTemplateId": "",
            "notificationMessageCCList": []
          },
          {
            "actionType": "block",
            "gracePeriodHours": 72,
            "notificationTemplateId": "",
            "notificationMessageCCList": []
          }
        ]
      }
    ]
  }
}
