{
  "$schema": "../../../schemas/policy.schema.json",
  "comment": [
    "App protection (MAM) for iOS. This is the control that matters most on a family tenant:",
    "most devices are personally owned, so protecting the data inside Outlook/OneDrive is more",
    "effective - and far less disruptive - than trying to fully manage the device.",
    "Applies across tiers only to members of the existing EveryoneButDad-SG dynamic user group.",
    "John stays a productivity/adult account but must not receive MAM from this tenant."
  ],
  "name": "ios-app-protection-baseline",
  "resource": "iosManagedAppProtections",
  "assignments": [{ "group": "sg-everyone-but-john", "intent": "include" }],
  "apps": [
    {
      "mobileAppIdentifier": {
        "@odata.type": "#microsoft.graph.iosMobileAppIdentifier",
        "bundleId": "com.microsoft.office.outlook"
      }
    },
    {
      "mobileAppIdentifier": {
        "@odata.type": "#microsoft.graph.iosMobileAppIdentifier",
        "bundleId": "com.microsoft.skydrive"
      }
    },
    {
      "mobileAppIdentifier": {
        "@odata.type": "#microsoft.graph.iosMobileAppIdentifier",
        "bundleId": "com.microsoft.officemobile"
      }
    },
    {
      "mobileAppIdentifier": {
        "@odata.type": "#microsoft.graph.iosMobileAppIdentifier",
        "bundleId": "com.microsoft.office.word"
      }
    },
    {
      "mobileAppIdentifier": {
        "@odata.type": "#microsoft.graph.iosMobileAppIdentifier",
        "bundleId": "com.microsoft.office.excel"
      }
    },
    {
      "mobileAppIdentifier": {
        "@odata.type": "#microsoft.graph.iosMobileAppIdentifier",
        "bundleId": "com.microsoft.office.powerpoint"
      }
    },
    {
      "mobileAppIdentifier": {
        "@odata.type": "#microsoft.graph.iosMobileAppIdentifier",
        "bundleId": "com.microsoft.onenote"
      }
    },
    {
      "mobileAppIdentifier": {
        "@odata.type": "#microsoft.graph.iosMobileAppIdentifier",
        "bundleId": "com.microsoft.msedge"
      }
    },
    {
      "mobileAppIdentifier": {
        "@odata.type": "#microsoft.graph.iosMobileAppIdentifier",
        "bundleId": "com.microsoft.skype.teams"
      }
    }
  ],
  "payload": {
    "@odata.type": "#microsoft.graph.iosManagedAppProtection",
    "displayName": "CaC - iOS - App Protection Baseline",
    "description": "Managed by sf-intune-cac. Do not edit in the portal.",
    "periodOfflineBeforeAccessCheck": "PT12H",
    "periodOnlineBeforeAccessCheck": "PT30M",
    "allowedInboundDataTransferSources": "allApps",
    "allowedOutboundDataTransferDestinations": "allApps",
    "allowedOutboundClipboardSharingLevel": "allApps",
    "organizationalCredentialsRequired": false,
    "dataBackupBlocked": false,
    "deviceComplianceRequired": false,
    "managedBrowserToOpenLinksRequired": false,
    "saveAsBlocked": false,
    "allowedDataStorageLocations": ["oneDriveForBusiness", "sharePoint", "box", "localStorage", "photoLibrary"],
    "periodOfflineBeforeWipeIsEnforced": "P90D",
    "pinRequired": false,
    "maximumPinRetries": 5,
    "simplePinBlocked": true,
    "minimumPinLength": 6,
    "pinCharacterSet": "numeric",
    "contactSyncBlocked": false,
    "printBlocked": false,
    "fingerprintBlocked": false,
    "faceIdBlocked": false,
    "appDataEncryptionType": "whenDeviceLocked",
    "filterOpenInToOnlyManagedApps": false
  }
}
