{
  "$schema": "../../../schemas/policy.schema.json",
  "comment": [
    "Companion to adult-enrollment-restriction-android-for-work.json: blocks the legacy Android",
    "device administrator enrollment path for adults too, so no Android MDM enrollment route is left",
    "open. Adults stay on MAM-only app protection (android-app-protection-baseline.json)."
  ],
  "name": "adult-enrollment-restriction-android",
  "resource": "deviceEnrollmentConfigurations",
  "assignments": [{ "group": "sg-tier-adult", "intent": "include" }],
  "payload": {
    "@odata.type": "#microsoft.graph.deviceEnrollmentPlatformRestrictionConfiguration",
    "displayName": "CaC - Enrollment - Adult Personal Devices (Android)",
    "description": "Managed by sf-intune-cac. Do not edit in the portal.",
    "priority": 2,
    "platformType": "android",
    "platformRestriction": {
      "@odata.type": "microsoft.graph.deviceEnrollmentPlatformRestriction",
      "platformBlocked": true,
      "personalDeviceEnrollmentBlocked": true,
      "blockedManufacturers": [],
      "blockedSkus": []
    }
  }
}
